<?xml version="1.0"?>
<!DOCTYPE rezept SYSTEM "Rezept.dtd">

<rezept rid=1>
	<rkopf datum="2022-03-18" aenderung="2022-03-18">
		<title>Apfelringe</title>
		<anzahl>12</anzahl>
		<zutat zid=12></zutat> <!-- Ueber ID referenzierte Zutat -->
		<zutat menge="1" mengeneinheit="Prise">Zimt</zutat>
	</rkopf>
	<rinhalt>Ã„pfel waschen und in scheiben Schneiden
	<zmsubstring zmid=14 zmbeginn=41 zmende=49>trocknen</zmsubstring> und mit Zimt bestreuen</rinhalt>
</rezept>
